Candidato; Sector; Coeficiente; Votos; Resultado
ARANDA RAMREZ, MAR페 PILAR; PROFESORADO DOCTOR VINCULACI흁 PERMANEN.; 0.063211; 565; 35.71
ARANDA RAMREZ, MAR페 PILAR; ESTUDIANTES; 0.007432; 2.410; 17.91
ARANDA RAMREZ, MAR페 PILAR; PERSONAL ADMINISTRACION Y SERVICIOS; 0.007491; 1.066; 7.99
ARANDA RAMREZ, MAR페 PILAR; RESTO PDI; 0.013468; 190; 2.56
ARANDA RAMREZ, MAR페 PILAR; PROFESORADO FUNCIONARIO NO DOCTOR; 0.042250; 27; 1.14
ARANDA RAMREZ, MAR페 PILAR; PROFESORADO ASOCIADO CIENCIAS SALUD; 0.017544; 12; 0.21
S쳁CHEZ-MONTESINOS GARC페, INDALECIO; PROFESORADO DOCTOR VINCULACI흁 PERMANEN.; 0.063211; 310; 19.60
S쳁CHEZ-MONTESINOS GARC페, INDALECIO; ESTUDIANTES; 0.007432; 954; 7.09
S쳁CHEZ-MONTESINOS GARC페, INDALECIO; PERSONAL ADMINISTRACION Y SERVICIOS; 0.007491; 536; 4.01
S쳁CHEZ-MONTESINOS GARC페, INDALECIO; RESTO PDI; 0.013468; 107; 1.44
S쳁CHEZ-MONTESINOS GARC페, INDALECIO; PROFESORADO FUNCIONARIO NO DOCTOR; 0.042250; 13; 0.55
S쳁CHEZ-MONTESINOS GARC페, INDALECIO; PROFESORADO ASOCIADO CIENCIAS SALUD; 0.017544; 45; 0.79